[
 {
  "jobId": "job_3654414",
  "clipId": "clip_01",
  "start": 2698.0,
  "end": 2758.0,
  "score": 78,
  "factors": {
   "chat": 1.782,
   "audio": 1.523,
   "speech": 1.972
  },
  "modalities": [
   "chat",
   "audio",
   "speech"
  ],
  "keep": true,
  "mood": "funny",
  "category": "funny moment",
  "title": {
   "zh": "香菜粽裡面真的有香菜😱",
   "en": "There's Actually Cilantro INSIDE the Dumpling 😱"
  },
  "hook": {
   "zh": "香菜粽驚魂！"
  },
  "caption": {
   "zh": "「我以為只是外面這個…」打開粽子發現裡面真的有香菜，表情全崩了😂 你敢吃嗎？",
   "en": "\"I thought it was just the outside…\" They opened the dumpling and found REAL cilantro inside — the reactions are priceless 😂 Would you eat it?"
  },
  "hashtags": [
   "#香菜粽",
   "#端午節",
   "#奇怪口味",
   "#食物挑戰",
   "#cilantro",
   "#funnyreaction",
   "#台灣美食"
  ],
  "clipKey": "clips/3654414/clip_01_funny.mp4",
  "thumbKey": "clips/3654414/clip_01_funny.jpg",
  "proxyKey": null,
  "createdAt": "2026-07-14T09:33:40+00:00",
  "peak": 2715,
  "reason": "The group's shocked and funny reaction to discovering a cilantro-filled rice dumpling (香菜粽) makes for a highly relatable and entertaining food-reaction clip."
 },
 {
  "jobId": "job_3654414",
  "clipId": "clip_02",
  "start": 3417.0,
  "end": 3476.0,
  "score": 78,
  "factors": {
   "chat": 1.45,
   "audio": 1.819,
   "speech": 3.029
  },
  "modalities": [
   "chat",
   "audio",
   "speech"
  ],
  "keep": true,
  "mood": "funny",
  "category": "funny moment",
  "title": {
   "zh": "把浣熊當貓帶回家？！",
   "en": "Who Would Mistake a Raccoon for a Cat?!"
  },
  "hook": {
   "zh": "浣熊當貓養😂"
  },
  "caption": {
   "zh": "誰比較可能把浣熊當貓帶回家？結果貓過敏的人直接投降😂 這題太荒唐了啦！",
   "en": "Which one of them would bring home a raccoon thinking it's a cat? The one with severe cat allergies immediately noped out 😂"
  },
  "hashtags": [
   "#浣熊",
   "#好笑瞬間",
   "#直播精華",
   "#funnymoment",
   "#livestream",
   "#台灣直播",
   "#raccoon"
  ],
  "clipKey": "clips/3654414/clip_02_funny.mp4",
  "thumbKey": "clips/3654414/clip_02_funny.jpg",
  "proxyKey": null,
  "createdAt": "2026-07-14T09:33:40+00:00",
  "peak": 3440,
  "reason": "The raccoon-mistaken-for-cat question triggers genuine laughter and a funny cat-allergy confession, with both hosts cracking up visibly in the keyframes and chat reacting with 🤣 emojis."
 },
 {
  "jobId": "job_3654414",
  "clipId": "clip_03",
  "start": 2074.0,
  "end": 2134.0,
  "score": 74,
  "factors": {
   "chat": 3.498,
   "audio": 1.267,
   "speech": -0.142
  },
  "modalities": [
   "chat",
   "audio"
  ],
  "keep": true,
  "mood": "funny",
  "category": "food reaction",
  "title": {
   "zh": "第一次吃減重粽！表情直接崩了😂",
   "en": "Trying a 'Diet Zongzi' for the First Time — Faces Say It All 😂"
  },
  "hook": {
   "zh": "減重粽竟然沒味道？！"
  },
  "caption": {
   "zh": "第一次見到減重粽，冰的、沒有餡、沒有調味⋯⋯沾糖吃？表情管理直接失敗哈哈哈 #端午節 #減重粽",
   "en": "First time trying a 'diet zongzi' — it's cold, has no filling, and zero flavour. The faces say everything 😂 #zongzi #foodreaction"
  },
  "hashtags": [
   "#減重粽",
   "#端午節",
   "#粽子",
   "#foodreaction",
   "#試吃",
   "#表情管理",
   "#zongzi",
   "#funny"
  ],
  "clipKey": "clips/3654414/clip_03_funny.mp4",
  "thumbKey": "clips/3654414/clip_03_funny.jpg",
  "proxyKey": null,
  "createdAt": "2026-07-14T09:33:40+00:00",
  "peak": 2110,
  "reason": "The group's genuine reactions—curiosity about a 'diet zongzi', the wobbly jelly-like reveal, failed toss attempt, and the priceless 'no flavour' face—create a funny food-reaction arc that chat clearly enjoyed (XDD, 哈哈哈哈, 表情管理, 這表情崩不住阿)."
 },
 {
  "jobId": "job_3654414",
  "clipId": "clip_04",
  "start": 3320.0,
  "end": 3356.0,
  "score": 74,
  "factors": {
   "chat": 1.322,
   "audio": 0.725,
   "speech": 1.76
  },
  "modalities": [
   "chat",
   "speech"
  ],
  "keep": true,
  "mood": "funny",
  "category": "funny moment",
  "title": {
   "zh": "女團排練無聊跳舞被抓包😂",
   "en": "Girl Group Can't Resist Mirrors During Rehearsal 😂"
  },
  "hook": {
   "zh": "女團看到鏡子必停！"
  },
  "caption": {
   "zh": "排練唱歌太無聊，忍不住在旁邊自己跳起舞來🕺🪞女團看到鏡子的魔力真的無法擋哈哈哈",
   "en": "Too bored during rehearsal so she just… started dancing 💀 Girl groups and mirrors are an unstoppable combo 🪞✨"
  },
  "hashtags": [
   "#女團",
   "#排練日常",
   "#鏡子魔力",
   "#笑死",
   "#girlgroup",
   "#rehearsal",
   "#台灣女團",
   "#直播精華"
  ],
  "clipKey": "clips/3654414/clip_04_funny.mp4",
  "thumbKey": "clips/3654414/clip_04_funny.jpg",
  "proxyKey": null,
  "createdAt": "2026-07-14T09:33:40+00:00",
  "peak": 3330,
  "reason": "The group hilariously reveals that during concert rehearsals one member got bored and started dancing in front of mirrors, leading to a relatable and funny discussion about girl-group mirror magnetism, with strong chat reactions (7777, 笑死, 發瘋喔)."
 },
 {
  "jobId": "job_3654414",
  "clipId": "clip_05",
  "start": 4064.0,
  "end": 4124.0,
  "score": 68,
  "factors": {
   "chat": 1.909,
   "audio": 1.989,
   "speech": 0.915
  },
  "modalities": [
   "chat",
   "audio",
   "speech"
  ],
  "keep": true,
  "mood": "funny",
  "category": "funny moment",
  "title": {
   "zh": "誰會假哭獲得優勢？😂成員互相爆料",
   "en": "Who Fake Cries to Win Arguments? Members Call Each Other Out 😂"
  },
  "hook": {
   "zh": "誰在假哭？😭"
  },
  "caption": {
   "zh": "這題也太傷人了吧😂 互相爆料環節直接開始，還有人65歲還被要求點兒童餐哈哈哈哈 #真的假的",
   "en": "\"Who fake cries to get their way?\" 😂 The members start calling each other out — plus someone gets told they look young enough to order a kids' meal at 65 lol"
  },
  "hashtags": [
   "#假哭",
   "#成員互爆",
   "#直播精華",
   "#搞笑時刻",
   "#idol",
   "#livestream",
   "#台灣女團"
  ],
  "clipKey": "clips/3654414/clip_05_funny.mp4",
  "thumbKey": "clips/3654414/clip_05_funny.jpg",
  "proxyKey": null,
  "createdAt": "2026-07-14T09:33:40+00:00",
  "peak": 4100,
  "reason": "A fun group Q&A game where members are asked who fake-cries to gain an advantage, leading to laughter and teasing, with the bonus payoff of the '65-year-old still being carded for a kids' meal' question that gets a great reaction."
 }
]