[
 {
  "jobId": "job_3654414",
  "clipId": "clip_01",
  "start": 3320.0,
  "end": 3355.0,
  "score": 78,
  "factors": {
   "chat": 1.322,
   "audio": 0.725,
   "speech": 1.76
  },
  "modalities": [
   "chat",
   "speech"
  ],
  "keep": true,
  "mood": "funny",
  "category": "funny moment",
  "title": {
   "zh": "女團排練無聊就跳舞？路過鏡子必照！",
   "en": "Girl group member admits she dances out of boredom at rehearsals 😂"
  },
  "hook": {
   "zh": "排練無聊跳起來😂"
  },
  "caption": {
   "zh": "排練唱歌太無聊，直接自己跳舞找樂子😂 女團路過鏡子全員必停下來整理儀容，這個魔力太真實了吧！",
   "en": "Too bored at concert rehearsals so she just… started dancing 😂 And apparently every girl group member is physically unable to walk past a mirror without stopping — too relatable!"
  },
  "hashtags": [
   "#女團日常",
   "#排練花絮",
   "#鏡子魔力",
   "#直播精華",
   "#girlgroup",
   "#rehearsal",
   "#funny",
   "#台灣女團"
  ],
  "clipKey": "clips/3654414/clip_01_funny.mp4",
  "thumbKey": "clips/3654414/clip_01_funny.jpg",
  "proxyKey": "clips/3654414/clip_01_funny.proxy.mp4",
  "createdAt": "2026-07-15T09:50:39+00:00",
  "peak": 3330,
  "reason": "A member hilariously admits she started dancing out of boredom during concert rehearsals, leading to the relatable punchline about girl groups being magnetically drawn to every mirror they pass — chat erupts with 7777s and '笑死'."
 },
 {
  "jobId": "job_3654414",
  "clipId": "clip_02",
  "start": 2074.0,
  "end": 2134.0,
  "score": 72,
  "factors": {
   "chat": 3.498,
   "audio": 1.267,
   "speech": -0.142
  },
  "modalities": [
   "chat",
   "audio"
  ],
  "keep": true,
  "mood": "funny",
  "category": "food reaction",
  "title": {
   "zh": "第一次吃減重粽！表情根本藏不住😂",
   "en": "Trying a 'Diet Zongzi' for the First Time — Can't Hide the Reaction 😂"
  },
  "hook": {
   "zh": "減重粽是什麼👀"
  },
  "caption": {
   "zh": "第一次挑戰減重粽，說好沒味道要沾糖，結果忘記沾😂表情管理完全失敗，觀眾全都看穿了哈哈哈！",
   "en": "First time trying a 'diet zongzi' — no filling, no seasoning, supposed to dip in sugar… but she forgot 😂 Facial expressions said it all!"
  },
  "hashtags": [
   "#減重粽",
   "#端午節",
   "#試吃反應",
   "#表情管理失敗",
   "#foodreaction",
   "#台灣美食",
   "#直播精華"
  ],
  "clipKey": "clips/3654414/clip_02_funny.mp4",
  "thumbKey": "clips/3654414/clip_02_funny.jpg",
  "proxyKey": "clips/3654414/clip_02_funny.proxy.mp4",
  "createdAt": "2026-07-15T09:50:39+00:00",
  "peak": 2110,
  "reason": "The group's genuine reactions to tasting an unfamiliar 'diet zongzi' — including failed expression management and the forgotten dipping sugar payoff — make for a naturally funny food-reaction clip with strong chat engagement."
 },
 {
  "jobId": "job_3654414",
  "clipId": "clip_03",
  "start": 2698.0,
  "end": 2756.0,
  "score": 72,
  "factors": {
   "chat": 1.782,
   "audio": 1.523,
   "speech": 1.972
  },
  "modalities": [
   "chat",
   "audio",
   "speech"
  ],
  "keep": true,
  "mood": "funny",
  "category": "food reaction",
  "title": {
   "zh": "香菜冰心粽挑戰！裡面真的有香菜😱",
   "en": "Cilantro Ice Dumpling Challenge – They Can't Believe It's Real"
  },
  "hook": {
   "zh": "粽子裡有香菜？！"
  },
  "caption": {
   "zh": "香菜花生冰心粽登場💀 打開的瞬間全員崩潰，哥直接說「太好了，那就是你的！」😂 你敢吃嗎？",
   "en": "A cilantro & peanut ice-filled rice dumpling appears and the whole crew loses it 😂 Would YOU eat this?"
  },
  "hashtags": [
   "#香菜",
   "#粽子",
   "#端午節",
   "#食物挑戰",
   "#FoodChallenge",
   "#搞笑",
   "#台灣美食"
  ],
  "clipKey": "clips/3654414/clip_03_funny.mp4",
  "thumbKey": "clips/3654414/clip_03_funny.jpg",
  "proxyKey": "clips/3654414/clip_03_funny.proxy.mp4",
  "createdAt": "2026-07-15T09:50:39+00:00",
  "peak": 2715,
  "reason": "The hosts discover a cilantro-filled rice dumpling and react with genuine shock and disgust, generating strong chat reactions and a clear comedic payoff."
 },
 {
  "jobId": "job_3654414",
  "clipId": "clip_04",
  "start": 4064.0,
  "end": 4124.0,
  "score": 72,
  "factors": {
   "chat": 1.909,
   "audio": 1.989,
   "speech": 0.915
  },
  "modalities": [
   "chat",
   "audio",
   "speech"
  ],
  "keep": true,
  "mood": "funny",
  "category": "funny moment",
  "title": {
   "zh": "吵架會假哭的人是誰？！",
   "en": "Who Fake-Cries to Win Arguments? 😂"
  },
  "hook": {
   "zh": "假哭獲勝術😱"
  },
  "caption": {
   "zh": "「誰會在吵架時假哭來獲得優勢？」成員互相指認超好笑，還有人65歲被要求點兒童餐😂 這題太犀利了！",
   "en": "'Who fake-cries during arguments to gain the upper hand?' Members immediately start pointing fingers — and then someone gets roasted for looking young enough to order a kids' meal at 65 😂"
  },
  "hashtags": [
   "#假哭",
   "#吵架技巧",
   "#成員互揭",
   "#直播精華",
   "#funnymoment",
   "#台灣直播",
   "#兒童餐"
  ],
  "clipKey": "clips/3654414/clip_04_funny.mp4",
  "thumbKey": "clips/3654414/clip_04_funny.jpg",
  "proxyKey": "clips/3654414/clip_04_funny.proxy.mp4",
  "createdAt": "2026-07-15T09:50:39+00:00",
  "peak": 4100,
  "reason": "A 'who fake-cries to win arguments' question sparks immediate laughter and finger-pointing among the members, followed by the bonus punchline about being mistaken for a child at 65 — two back-to-back funny reveals that drive strong chat reaction."
 },
 {
  "jobId": "job_3654414",
  "clipId": "clip_05",
  "start": 3417.0,
  "end": 3475.0,
  "score": 72,
  "factors": {
   "chat": 1.45,
   "audio": 1.819,
   "speech": 3.029
  },
  "modalities": [
   "chat",
   "audio",
   "speech"
  ],
  "keep": true,
  "mood": "funny",
  "category": "funny moment",
  "title": {
   "zh": "誰會把浣熊當貓帶回家？😂",
   "en": "Who Would Bring a Raccoon Home Thinking It's a Cat?"
  },
  "hook": {
   "zh": "浣熊當貓養🦝"
  },
  "caption": {
   "zh": "這題太荒唐了吧！貓過敏還要帶浣熊回家？笑死😂 #猜猜我是誰",
   "en": "The most chaotic 'who would' question ever — raccoon as a pet cat?? 😂 The laughter says it all."
  },
  "hashtags": [
   "#浣熊",
   "#好笑瞬間",
   "#直播精華",
   "#猜猜我是誰",
   "#funnymoment",
   "#livestream",
   "#台灣直播"
  ],
  "clipKey": "clips/3654414/clip_05_funny.mp4",
  "thumbKey": "clips/3654414/clip_05_funny.jpg",
  "proxyKey": "clips/3654414/clip_05_funny.proxy.mp4",
  "createdAt": "2026-07-15T09:50:39+00:00",
  "peak": 3440,
  "reason": "The raccoon-mistaken-for-cat question triggers genuine burst laughter from both hosts, with great facial expressions visible in keyframes and chat reacting with laughing emojis—a relatable, funny game-show moment."
 }
]